gate_id,gate_status,evidence,formula_freeze_allowed,endpoint_scores_allowed,remaining_obligation,claim_boundary
N4183_FORMULA_G1_LABEL_DERIVATION_ALLOWED,PASS,NARROW_REPLACEMENT_LABEL_SUPPORTED_FOR_FORMULA_DERIVATION_NOT_ENDPOINT,False,False,derive only; freeze separately,ngc4183_projection_outer_warp_formula_derivation_not_endpoint
N4183_FORMULA_G2_DIMENSIONAL_CONSISTENCY,PASS,gamma_proj and K_proj dimensionless; carrier has velocity-squared units,False,False,none for shell,ngc4183_projection_outer_warp_formula_derivation_not_endpoint
N4183_FORMULA_G3_KNOWN_LIMITS,PASS,gamma=0 and inactive kernel recover carrier; face-on p_edge tends to zero,False,False,none for shell,ngc4183_projection_outer_warp_formula_derivation_not_endpoint
N4183_FORMULA_G4_COEFFICIENT_RULE,BLOCKED,gamma_proj is not source-frozen,False,False,derive/freeze gamma_proj without residuals,ngc4183_projection_outer_warp_formula_derivation_not_endpoint
N4183_FORMULA_G5_WARP_RAMP,BLOCKED,outer warp is qualitative only,False,False,do not include added warp ramp unless onset/amplitude is acquired,ngc4183_projection_outer_warp_formula_derivation_not_endpoint
