galaxy,mixed_readout_candidate,gate_id,gate_status,evidence,remaining_obligation,endpoint_scores_allowed,diagnostic_scores_allowed,claim_boundary
NGC4013,K_expdisk_warp_vertical_overlay,MSR1_SMOOTH_DISK_CARRIER_SUPPORTED,PASS,S4G edge-disk component and source disk scales are present,covered by the residual-blind mixed source-selection rule,False,True,ngc4013_mixed_source_rule_audit_not_endpoint
NGC4013,K_expdisk_warp_vertical_overlay,MSR2_OVERLAY_COMPONENT_SUPPORTED,PASS_CAVEATED,"warp onset, vertical h/R, extended component, and lag context are present",replace caveated lag shell with source-map digitization if needed,False,True,ngc4013_mixed_source_rule_audit_not_endpoint
NGC4013,K_expdisk_warp_vertical_overlay,MSR3_COMPACT_ONLY_REJECTED,PASS,COMPACT_ENDPOINT_NOT_SOURCE_SUPPORTED,none unless future compact evidence overturns this review,False,True,ngc4013_mixed_source_rule_audit_not_endpoint
NGC4013,K_expdisk_warp_vertical_overlay,MSR4_DIAGNOSTIC_SCORE_EXCLUDED,PASS,diagnostic RMSE row is marked endpoint_label_input_allowed=False,do not use diagnostic fit as source-label evidence,False,True,ngc4013_mixed_source_rule_audit_not_endpoint
NGC4013,K_expdisk_warp_vertical_overlay,MSR5_GENERAL_SOURCE_RULE,PASS_FORMULA_FREEZE_REQUIRED,residual-blind mixed source-selection rule passes this case,freeze the mixed carrier-plus-overlay formula before endpoint scoring,False,True,ngc4013_mixed_source_rule_audit_not_endpoint
