gate_id,gate_status,evidence,remaining_obligation,galaxy,endpoint_scores_allowed,validation_claim_allowed,claim_boundary
N4013_PRG1_SOURCE_FREEZE_REVIEW,PASS_CAVEATED,NGC4013_MIXED_OVERLAY_SOURCE_FREEZE_PASS_CAVEATED_PROSPECTIVE_ONLY,keep prior diagnostic score out of label evidence,NGC4013,False,False,ngc4013_mixed_overlay_prospective_replay_gate_not_validation
N4013_PRG2_LANE_FREEZE,PASS_CAVEATED,L_mixed_overlay_protocol_ready_not_retroactive,no retroactive validation claim,NGC4013,False,False,ngc4013_mixed_overlay_prospective_replay_gate_not_validation
N4013_PRG3_FORMULA_FREEZE,PASS,MIXED_FORMULA_FREEZE_READY_NOT_RETROACTIVE_ENDPOINT,use same manifest unchanged in future population tests,NGC4013,False,False,ngc4013_mixed_overlay_prospective_replay_gate_not_validation
N4013_PRG4_RETROACTIVE_CLAIM_BOUNDARY,PASS,retrospective_endpoint_scores_allowed=False,score can be continuity evidence only,NGC4013,False,False,ngc4013_mixed_overlay_prospective_replay_gate_not_validation
N4013_PRG5_REPLAY_SCORE,PASS_RECORDED_NOT_VALIDATION,frozen protocol RMSE=10.6148,repeat prospectively on future predeclared cases,NGC4013,False,False,ngc4013_mixed_overlay_prospective_replay_gate_not_validation
