galaxy,gate_id,gate_status,evidence,remaining_obligation,endpoint_scores_allowed,uses_vobs_or_residual,claim_boundary
NGC4088,SL1_KERNEL_IS_RESIDUAL_BLIND_AND_DIMENSIONLESS,PASS,"C_warp is frozen from source-side x_w, p, q_warp and is dimensionless",none at kernel/dimension level,False,False,ngc4088_b2_source_load_closure_functional_gate_not_endpoint
NGC4088,SL2_SOURCE_LOAD_ALIGNED_TO_FREEZE,PASS,"Lambda_tau computed from frozen sigma, q_warp, x_w, and Vflat reproduces lambda_w",none at formula-freeze alignment level,False,False,ngc4088_b2_source_load_closure_functional_gate_not_endpoint
NGC4088,SL3_EULER_STATIONARITY,PASS,"for kappa_lambda>0 and nonzero kernel norm, dJ/dlambda_w=0 yields lambda_w=Lambda_tau",derive kappa_lambda and norm weight from Tau-side closure geometry,False,False,ngc4088_b2_source_load_closure_functional_gate_not_endpoint
NGC4088,SL4_ZERO_SOURCE_LIMIT,PASS,sigma_warp=0 or q_warp=0 gives Lambda_tau=0 and the stationary correction vanishes,none at zero-source limit level,False,False,ngc4088_b2_source_load_closure_functional_gate_not_endpoint
NGC4088,SL5_INACTIVE_WINDOW_LIMIT,PASS,"C_warp=0 for R/R_HI <= x_w, so the readout recovers the carrier in the inactive window",none at inactive-window limit level,False,False,ngc4088_b2_source_load_closure_functional_gate_not_endpoint
NGC4088,SL6_SOURCE_LOAD_ORIGIN,OPEN,the source-load form is explicit but not derived as the unique Tau-side closure load,derive why Lambda_tau must be sigma_warp q_warp x_w Vflat^2,False,False,ngc4088_b2_source_load_closure_functional_gate_not_endpoint
NGC4088,SL7_ASYMPTOTIC_CARRIER_ORIGIN,OPEN,ASYMPTOTIC_CARRIER_DOMINANCE_NOT_DERIVED,derive Vflat^2 as the forced asymptotic carrier,False,False,ngc4088_b2_source_load_closure_functional_gate_not_endpoint
NGC4088,SL8_CROSS_TERM_BOUND,OPEN,CROSS_TERMS_DECLARED_NOT_SUPPRESSED,prove cross-term suppression or freeze a source-side uncertainty interval,False,False,ngc4088_b2_source_load_closure_functional_gate_not_endpoint
