galaxy,formula_id,gate_id,gate_status,evidence,remaining_obligation,mixed_endpoint_scores_allowed,prospective_mixed_protocol_ready,claim_boundary
NGC7331,NGC7331_EXPDISK_VERTICAL_OUTER_WARP_MIXED_FREEZE_V1,N7331_MXF1_CAVEAT_GATE,PASS_CAVEATED,CAVEAT_MAPPED_TO_MIXED_OVERLAY_CONTEXT_FORMULA_FREEZE_ALLOWED,numeric outer-warp onset still absent; broad source-scale window only,False,True,ngc7331_expdisk_vertical_outer_warp_mixed_formula_freeze_not_score
NGC7331,NGC7331_EXPDISK_VERTICAL_OUTER_WARP_MIXED_FREEZE_V1,N7331_MXF2_VERTICAL_AMPLITUDE_MAPPING,PASS,vertical_activation_candidate=0.63081; gamma_vow=0.315405,"amplitude is source-rule candidate, not final Tau-side vertical law",False,True,ngc7331_expdisk_vertical_outer_warp_mixed_formula_freeze_not_score
NGC7331,NGC7331_EXPDISK_VERTICAL_OUTER_WARP_MIXED_FREEZE_V1,N7331_MXF3_BROAD_OUTER_WINDOW,PASS_CAVEATED,R_inner=Rdisk=5.02 kpc; R_outer=RHI=27.01 kpc,replace with numeric HI/projection warp onset if extracted later,False,True,ngc7331_expdisk_vertical_outer_warp_mixed_formula_freeze_not_score
NGC7331,NGC7331_EXPDISK_VERTICAL_OUTER_WARP_MIXED_FREEZE_V1,N7331_MXF4_DIMENSION_AND_LIMITS,PASS,dimensionless attenuation times velocity-squared carrier; inactive window and gamma=0 recover carrier,none at formula-shell level,False,True,ngc7331_expdisk_vertical_outer_warp_mixed_formula_freeze_not_score
NGC7331,NGC7331_EXPDISK_VERTICAL_OUTER_WARP_MIXED_FREEZE_V1,N7331_MXF5_ENDPOINT_BLINDNESS,PASS,"construction reads caveat summary, source queue, and SPARC scale metadata only; no vobs or residuals","mixed scoring, if run, must be a separate script reading this manifest unchanged",False,True,ngc7331_expdisk_vertical_outer_warp_mixed_formula_freeze_not_score
