galaxy,gate_id,gate_status,evidence,remaining_obligation,endpoint_scores_allowed,uses_vobs_or_residual,claim_boundary
NGC7331,N7331_QRESP1_ALLOWED_OUTCOME,PASS,review_decision=CARRY_INTERVAL,carry q interval into formula-freeze gate,False,False,ngc7331_qwarp_source_only_review_response_not_endpoint
NGC7331,N7331_QRESP2_SOURCE_ONLY_INPUTS,PASS,ngc7331_things_qwarp_first_pass_measurements.csv;ngc7331_things_qwarp_measurement_sensitivity.csv;ngc7331_things_mom1_sign_cross_measurements.csv;ngc7331_qwarp_observable_choice_candidates.csv,preserve source-only provenance,False,False,ngc7331_qwarp_source_only_review_response_not_endpoint
NGC7331,N7331_QRESP3_FORBIDDEN_INPUTS,PASS,forbidden_inputs_used=none,keep endpoint scoring separate,False,False,ngc7331_qwarp_source_only_review_response_not_endpoint
NGC7331,N7331_QRESP4_SIGN_CONTEXT,PASS_CONTEXT,receding_consensus=CONSISTENT; inner_outer_same=True,exact formula freeze must state added-readout/attenuation sign,False,False,ngc7331_qwarp_source_only_review_response_not_endpoint
NGC7331,N7331_QRESP5_EPSILON_BOUND,PASS_CONSERVATIVE_BOUND,epsilon_cross_candidate_bound=0.488571,carry bound caveat; do not treat as endpoint validation,False,False,ngc7331_qwarp_source_only_review_response_not_endpoint
NGC7331,N7331_QRESP6_ENDPOINT_BLINDNESS,PASS,"response does not read vobs, residuals, endpoint scores, or baselines",endpoint scoring remains separate,False,False,ngc7331_qwarp_source_only_review_response_not_endpoint
