stage,stage_status,n_galaxies,n_blocked,endpoint_scores_computed,next_action,accepted_labels_created,claim_boundary
external_imaging_request_manifest,SOURCE_REQUEST_READY,4,0,False,use source requests for residual-blind review,False,p0_review_pipeline_status_not_label_not_endpoint
skyview_availability_audit,AVAILABLE_SOURCE_PREFLIGHT_COMPLETE,4,0,False,render source previews without image classification,False,p0_review_pipeline_status_not_label_not_endpoint
skyview_preview_images,PREVIEW_SOURCE_MATERIAL_READY,4,0,False,use previews only as residual-blind review source material,False,p0_review_pipeline_status_not_label_not_endpoint
visual_review_template,REVIEW_TEMPLATE_READY,4,0,False,fill review fields residual-blind,False,p0_review_pipeline_status_not_label_not_endpoint
visual_review_completion_gate,BLOCKED_VISUAL_REVIEW_PENDING,4,4,False,complete residual-blind visual review fields,False,p0_review_pipeline_status_not_label_not_endpoint
visual_review_handoff,READY_FOR_RESIDUAL_BLIND_HUMAN_REVIEW,4,4,False,send handoff to residual-blind reviewer,False,p0_review_pipeline_status_not_label_not_endpoint
visual_review_response_intake,BLOCKED_REVIEW_RESPONSE_PENDING,4,4,False,fill response template before independent manifest audit,False,p0_review_pipeline_status_not_label_not_endpoint
response_to_manifest_promotion_gate,BLOCKED_RESPONSE_REVIEW_NOT_PROMOTABLE,4,4,False,do not promote labels until all promotion gates pass,False,p0_review_pipeline_status_not_label_not_endpoint
missing_data_source_acquisition_plan,SOURCE_PLAN_READY,4,0,False,acquire S4G/NED/DustPedia/HI/PHANGS evidence residual-blind,False,p0_review_pipeline_status_not_label_not_endpoint
