gate,gate_status,blocked_rows,decision_rule,accepted_manifest_audit_entry_allowed,endpoint_scores_computed,claim_boundary
response_intake_complete,BLOCKED,4,all P0 response rows pass the response intake validator,False,False,p0_response_to_manifest_promotion_gate_not_endpoint
forbidden_inputs_absent,PASS,0,no endpoint-derived forbidden input is present in review responses,True,False,p0_response_to_manifest_promotion_gate_not_endpoint
review_confidence_present,BLOCKED,4,review confidence is supplied for every P0 row,False,False,p0_response_to_manifest_promotion_gate_not_endpoint
family_recommendation_present,BLOCKED,4,residual-blind family recommendation is supplied for every P0 row,False,False,p0_response_to_manifest_promotion_gate_not_endpoint
history_memory_judgment_present,BLOCKED,4,morphological memory/history proxy judgment is supplied for every P0 row,False,False,p0_response_to_manifest_promotion_gate_not_endpoint
