galaxy,gate_id,gate_status,evidence,remaining_obligation,uses_vobs_or_residual,endpoint_scores_allowed,claim_boundary
NGC4088,H1_PROTOCOL_DEFINED,PASS,morphological-history proxy components are declared,none at protocol-definition level,False,False,s4g75_ngc4088_memory_history_proxy_protocol_not_endpoint
NGC4088,H2_SOURCE_LANE_AVAILABLE,PASS,WHISP warp/asymmetry source lane is available,none at source-lane level,False,False,s4g75_ngc4088_memory_history_proxy_protocol_not_endpoint
NGC4088,H3_INVERSE_PROXY_EXCLUDED,PASS,protocol forbids rotation-inferred family and endpoint residuals,keep generic inverse morphology-history proxy separate,False,False,s4g75_ngc4088_memory_history_proxy_protocol_not_endpoint
NGC4088,H4_COMPONENT_MEASUREMENTS_FILLED,BLOCKED,m_history components are empty,perform residual-blind source review/measurement,False,False,s4g75_ngc4088_memory_history_proxy_protocol_not_endpoint
NGC4088,H5_INDEPENDENT_REVIEW,BLOCKED,no independent morphological-history review exists,independent reviewer must verify m_history_warp,False,False,s4g75_ngc4088_memory_history_proxy_protocol_not_endpoint
NGC4088,H6_EPSILON_BOUND_CONNECTION,FORMULA_CONDITIONAL,m_history_warp would supply the B_mem f_mem term in the epsilon_cross bound,derive/predeclare B_mem coefficient,False,False,s4g75_ngc4088_memory_history_proxy_protocol_not_endpoint
